Recetas,Duracion,Dificultad,Valoracion,Tipo
Receta de Romanescu con jam n,30m,baja,90.00%,Rumanescu
Receta de Arepa de queso,45m,baja,90.00%,Arepas
Receta de Chipa de queso,30m,baja,88.60%,Pan
Receta de Muffins de chocolate con pepitas de chocolate,30m,baja,80.00%,Cupcakes
Receta de Pasteles chilenitos,1h 30m,media,93.40%,Hojaldre dulce
Receta de Torta napole n,2h 30m,media,90.00%,Pasteles
Receta de Marquesas de almendra,30m,baja,38.40%,Postres con frutos secos
Receta de Panellets de caf ,45m,baja,80.00%,Otros postres
T  helado,10m,baja,90.00%,T 
Receta de Salsa pomarola,1h 30m,baja,80.00%,Salsas rojas
Receta de Hot dog americano original,10m,baja,100.00%,Salchicha
Receta de Ensalada de betarraga,45m,baja,80.00%,Ensaladas saludables
Ponche de almendras,30m,baja,72.00%,Ponche
Receta de Tortilla de zucchini,15m,baja,66.60%,Calabac n
Receta de Pasticho de pl tano,1h 30m,media,78.20%,Lasa a
Receta de Polenta italiana,30m,baja,60.00%,Otros cereales
Receta de Pizza porte a,1h 30m,baja,80.00%,Pizza
Receta de Medialunas grandes,6h,alta,100.00%,Boller a
Receta de Medialunas hojaldradas,8h,alta,80.00%,Hojaldre dulce
Receta de Sopaipillas veganas,30m,baja,86.60%,Otros aperitivos
Receta de Papas pay,15m,baja,20.00%,Patata
Terremoto sin alcohol,10m,baja,100.00%,C cteles
Receta de Medialunas con tapa de empanadas,15m,baja,100.00%,Bollos
Receta de Medialunas con tapas de pascualina,15m,baja,65.00%,Bollos
Receta de Crema diplomata,2h 30m,media,84.00%,Cremas pasteleras
Receta de Pan caracol,1h 30m,media,100.00%,Pan
Receta de Galette des rois o pastel de Reyes,1h 30m,media,69.20%,Pasteles
Receta de Torta pompadour de pl tano,1h 30m,media,90.00%,Pasteles
Receta de Arrollado de malaya,2h 30m,media,60.00%,Vaca
Receta de Caldo de pata,3h,alta,93.40%,Caldos
Receta de Torta amor chilena,6h,alta,100.00%,Hojaldre dulce
Receta de Torta 4 leches,6h,alta,80.00%,Pasteles
Receta de Torta tres leches con crema chantilly,24h,media,80.00%,Tartas
Receta de Bu uelos dulces fritos,15m,baja,81.00%,Bollos
Receta de Postre borracho,45m,baja,79.60%,Pasteles
Receta de Sopaipillas sin levadura,30m,baja,86.60%,Otros aperitivos
Receta de Caramelo para quesillo,30m,baja,92.20%,Flan
Receta de Pan de Pascua con frutas confitadas,1h 30m,baja,80.00%,Bollos
Receta de Carne mongoliana con arroz,45m,baja,96.00%,Vaca
Receta de Galletas de avena f ciles y r pidas,15m,baja,85.80%,Galletas
"Receta de Crema de calabaza, zanahoria y puerro",45m,baja,100.00%,Cremas
Receta de Bollos pelones,1h 30m,baja,100.00%,Otros aperitivos
Receta de Galletas de mantequilla caseras,45m,baja,81.20%,Galletas
Receta de Medialunas con dulce de leche,2h 30m,baja,60.00%,Bollos
Receta de Tarta de br coli y espinaca,45m,baja,80.00%,Quiche
Receta de Pichanga sure a,45m,baja,100.00%,Otros aperitivos
Receta de Tortilla de acelga y zanahoria,45m,media,80.00%,Tortillas
Receta de Pur  de calabaza y patata original,8h,baja,100.00%,Cremas
Receta de Pencas de acelga en escabeche,30m,baja,66.60%,Acelgas
Receta de Ceviche peruano,30m,baja,79.20%,Ceviches
Receta de Causa chiclayana,45m,media,87.80%,Pescado blanco
Receta de Salpic n chileno,30m,media,78.00%,Ensaladas con carne
Receta de Sopa de menestr n,1h 30m,media,93.40%,Sopas
Receta de Queque keto,45m,media,84.40%,Bizcochos
Receta de Torta de panqueque de naranja,3h,baja,100.00%,Crepes dulces
Receta de Medialunas con harina 000,2h 30m,media,82.80%,Hojaldre dulce
Receta de Queque sin gluten,45m,media,76.40%,Pasteles
Receta de Pasta frola sin tacc,1h 30m,media,90.00%,Tartas
Receta de Bud n de lim n sin TACC,1h 30m,media,79.00%,Flan
Receta de Tomatic n criollo,45m,media,95.00%,Guiso
Receta de Bu uelos juje os,3h,media,80.00%,Bollos
Receta de Chupe de guatitas,1h 30m,media,100.00%,Cocido
Receta de Causa acevichada,45m,media,87.80%,Pescado blanco
Receta de Causa ferre afana,45m,media,87.80%,Pescado blanco
Receta de Frangipane,30m,media,90.00%,Cremas pasteleras
Receta de Pan amasado chileno,1h 30m,media,100.00%,Pan
Receta de Causa de pescado,45m,media,80.00%,Pescado blanco
Receta de Chupe de camarones arequipe o,45m,media,80.00%,Camarones
Receta de Causa de langostinos,45m,media,100.00%,Langostinos
Receta de Arrollado de huaso,6h,media,80.00%,Cerdo
Receta de Croquetas de patata y pollo,1h 30m,media,67.40%,Croquetas
Receta de Chupe de locos,1h 30m,media,74.20%,Otros mariscos
Receta de Flan de huevo con leche condensada en freidora de aire,45m,media,63.20%,Flan
Receta de Papa rellena con ceviche,1h 30m,media,80.00%,Patata
Receta de Alfajor Rogel,1h 30m,media,90.00%,Tartas
Receta de Chupe de jaiba,1h 30m,media,100.00%,Cangrejo
Receta de Carne al jugo en olla a presi n,45m,media,80.00%,Vaca
Receta de Calugas chilenas,1h 30m,media,72.00%,Otros postres
Receta de Bud n de pan con manjar,30m,baja,83.80%,Flan
Receta de Pollo broaster con arroz,45m,media,86.60%,Pollo
Receta de Torta chilena,1h 30m,media,100.00%,Hojaldre dulce
Receta de Donuts en freidora de aire,1h 30m,media,83.00%,Boller a
Receta de Chilenitos dulces,1h 30m,media,100.00%,Hojaldre dulce
Receta de Pastelitos hojaldrados,2h 30m,media,80.00%,Hojaldre dulce
Receta de Pollo a la chiclayana,45m,media,90.00%,Pollo
Receta de Pan franc s peruano,1h 30m,media,70.20%,Pan
Receta de Gelatina de mazap n,6h,media,100.00%,Gelatinas caseras
Receta de Pollo al durazno,45m,baja,50.00%,Pollo
Receta de Panetón sin pasas,1h 30m,media,93.40%,Pan
Receta de Budín de pan con pan lactal,4h,baja,88.40%,Bizcochos
Receta de Romanescu con jamón,30m,baja,90.00%,Rumanescu
